{
  "attribution_confidence": "high",
  "attribution_hash": "41f28700eaaa596b60e5d775d2d014827a4200f3595c90b3d689bf684584165d",
  "attribution_id": "evaluation-governance-offline-chain-attribution-001",
  "attribution_summary": "Outcome changed from allow to escalate; detected causes: evaluator_version_changed, rule_version_changed, authority_state_changed, consequence_class_changed.",
  "current_evaluation_receipt_hash": "81c64573c36975ccf755f53718d1b759d00f612832aee47c35081117824a9cfa",
  "current_evaluation_receipt_ref": "evaluation-governance-offline-chain-receipt-002",
  "current_outcome": "escalate",
  "delta_causes": [
    {
      "cause_type": "evaluator_version_changed",
      "current_value_ref": "eval-v1.1.0",
      "evidence_refs": [
        "evaluation-governance-offline-chain-receipt-002"
      ],
      "explanation": "The evaluator version changed between receipts.",
      "prior_value_ref": "eval-v1.0.0",
      "severity": "medium"
    },
    {
      "cause_type": "rule_version_changed",
      "current_value_ref": "rules-v2",
      "evidence_refs": [
        "evaluation-governance-offline-chain-receipt-002"
      ],
      "explanation": "The rule set version changed between receipts.",
      "prior_value_ref": "rules-v1",
      "severity": "medium"
    },
    {
      "cause_type": "authority_state_changed",
      "current_value_ref": "[\"authority-evidence-example-v2\"]",
      "evidence_refs": [
        "evaluation-governance-offline-chain-receipt-002"
      ],
      "explanation": "The authority evidence references changed between receipts.",
      "prior_value_ref": "[\"authority-evidence-example-v1\"]",
      "severity": "high"
    },
    {
      "cause_type": "consequence_class_changed",
      "current_value_ref": "{\"class_id\": \"synthetic-high-evaluation-governance-event\", \"class_label\": \"high\", \"classifier_id\": \"synthetic-trajectory-classifier\", \"classifier_version\": \"1.0.0-demo\"}",
      "evidence_refs": [
        "evaluation-governance-offline-chain-receipt-002"
      ],
      "explanation": "The consequence classification changed between receipts.",
      "prior_value_ref": "{\"class_id\": \"synthetic-medium-evaluation-governance-event\", \"class_label\": \"medium\", \"classifier_id\": \"synthetic-trajectory-classifier\", \"classifier_version\": \"1.0.0-demo\"}",
      "severity": "high"
    }
  ],
  "issued_at": "2026-01-01T00:00:00Z",
  "outcome_changed": true,
  "prior_evaluation_receipt_hash": "5cae168299c60becc997dde84fc143fa059edc2b5fca81dde1997f5916f4500f",
  "prior_evaluation_receipt_ref": "evaluation-governance-offline-chain-receipt-001",
  "prior_outcome": "allow",
  "recommended_governance_action": "review",
  "schema_version": "outcome-delta-attribution-v1",
  "unresolved_delta": {
    "present": false,
    "reason": "No unexplained evaluation drift was detected.",
    "requires_review": false
  }
}
